{
  "id": "rel_bt3sccp9",
  "unite_source_id": "unt_c0gzykqg",
  "unite_cible_id": "unt_7np98nyh",
  "type_code": "forme_de_composition",
  "fait": {
    "confiance": "etablie",
    "etat_relecture": "brouillon",
    "sources": [],
    "note_interne": "À vérifier : entrée « ἀνά » du Bailly, localisation à renseigner. Wikidata ne porte pas ce fait (consulté le 10 octobre 2026, ADR 0060) : aucune déclaration « dérivé du lexème » entre « ana » (sans lexème) et « ἀνά » (sans lexème). Non publiable tant que Wikidata ne le porte pas."
  }
}
