{
  "id": "rel_z7wvx736",
  "unite_source_id": "unt_gr2jq6gg",
  "unite_cible_id": "unt_5cfw2nca",
  "type_code": "forme_de_composition",
  "fait": {
    "confiance": "etablie",
    "etat_relecture": "brouillon",
    "sources": [
      {
        "source_id": "src_1g2et8hj",
        "localisation": null
      }
    ],
    "note_interne": "À vérifier : entrée « ἄρχειν » du Bailly, localisation à renseigner."
  }
}
