{
  "id": "rel_p7rh17z2",
  "unite_source_id": "unt_5c7jv9px",
  "unite_cible_id": "unt_5exbn5vg",
  "type_code": "emprunt",
  "fait": {
    "confiance": "etablie",
    "etat_relecture": "brouillon",
    "sources": [],
    "note_interne": "Chaîne relue dans la rubrique « Étymologie et histoire » de l’entrée « baromètre » du TLFi, le 9 octobre 2026. Wikidata ne porte pas ce fait (consulté le 10 octobre 2026, ADR 0060) : aucune déclaration « dérivé du lexème » entre « baromètre » (L27716) et « barometer » (L253904). Non publiable tant que Wikidata ne le porte pas."
  }
}
