{
  "id": "rel_h1nrm6dg",
  "unite_source_id": "unt_frejp334",
  "unite_cible_id": "unt_yqmf6v2d",
  "type_code": "emprunt",
  "fait": {
    "confiance": "etablie",
    "etat_relecture": "brouillon",
    "sources": [],
    "note_interne": "Chaîne relue dans la rubrique « Étymologie et histoire » de l’entrée « chronographe » du TLFi, le 9 octobre 2026. Wikidata ne porte pas ce fait (consulté le 10 octobre 2026, ADR 0060) : aucune déclaration « dérivé du lexème » entre « chronographus » (L263705) et « χρονογράφος » (L1102192). Non publiable tant que Wikidata ne le porte pas."
  }
}
