{
  "id": "rel_y14pcvan",
  "unite_source_id": "unt_tra5q3q9",
  "unite_cible_id": "unt_c4mhjzy1",
  "type_code": "emprunt",
  "fait": {
    "confiance": "etablie",
    "etat_relecture": "brouillon",
    "sources": [],
    "note_interne": "Chaîne relue dans la rubrique « Étymologie et histoire » de l’entrée « paléographie » du TLFi, le 9 octobre 2026. Wikidata ne porte pas ce fait (consulté le 10 octobre 2026, ADR 0060) : aucune déclaration « dérivé du lexème » entre « paléographie » (L1582908) et « palaeographia » (sans lexème). Non publiable tant que Wikidata ne le porte pas."
  }
}
