{
  "id": "rel_qcenbpjh",
  "unite_source_id": "unt_hrqrkkdj",
  "unite_cible_id": "unt_a3e215zn",
  "type_code": "forme_de_composition",
  "fait": {
    "confiance": "etablie",
    "etat_relecture": "relu",
    "sources": [],
    "note_interne": "À vérifier : entrée « μῦς » du Bailly, localisation à renseigner. Wikidata ne porte pas ce fait (consulté le 10 octobre 2026, ADR 0060) : aucune déclaration « dérivé du lexème » entre « myo » (sans lexème) et « μῦς » (L1102618). Non publiable tant que Wikidata ne le porte pas."
  }
}
