{
  "id": "rel_jasdpacy",
  "unite_source_id": "unt_h026v52k",
  "unite_cible_id": "unt_rymebc5n",
  "type_code": "forme_de_composition",
  "fait": {
    "confiance": "etablie",
    "etat_relecture": "brouillon",
    "sources": [],
    "note_interne": "À vérifier : entrée « mille » du Gaffiot, localisation à renseigner. Wikidata ne porte pas ce fait (consulté le 10 octobre 2026, ADR 0060) : aucune déclaration « dérivé du lexème » entre « milli » (L20365) et « mille » (L278705 ou L278704). Non publiable tant que Wikidata ne le porte pas."
  }
}
