{
  "id": "rel_xmwadjzh",
  "unite_source_id": "unt_9sh839p6",
  "unite_cible_id": "unt_5c6c6ayh",
  "type_code": "forme_de_composition",
  "fait": {
    "confiance": "etablie",
    "etat_relecture": "brouillon",
    "sources": [],
    "note_interne": "À vérifier : entrée « γαστήρ » du Bailly, localisation à renseigner. Wikidata ne porte pas ce fait (consulté le 10 octobre 2026, ADR 0060) : aucune déclaration « dérivé du lexème » entre « gastro » (sans lexème) et « γαστήρ » (L1101919). Non publiable tant que Wikidata ne le porte pas."
  }
}
