{
  "id": "rel_beb4t84k",
  "unite_source_id": "unt_fyyfm615",
  "unite_cible_id": "unt_xnyawf13",
  "type_code": "emprunt",
  "fait": {
    "confiance": "etablie",
    "etat_relecture": "relu",
    "sources": [],
    "note_interne": "Chaîne relue dans la rubrique « Étymologie et histoire » de l’entrée « astrologue » du TLFi, le 9 octobre 2026. Wikidata ne porte pas ce fait (consulté le 10 octobre 2026, ADR 0060) : aucune déclaration « dérivé du lexème » entre « astrologus » (L259510) et « ἀστρολόγος » (L1111283). Non publiable tant que Wikidata ne le porte pas."
  }
}
