{
  "id": "rel_tn5ehqgn",
  "unite_source_id": "unt_v6yfk41q",
  "unite_cible_id": "unt_dwkamznp",
  "type_code": "forme_de_composition",
  "fait": {
    "confiance": "etablie",
    "etat_relecture": "relu",
    "sources": [],
    "note_interne": "À vérifier : entrée « γονή » du Bailly, localisation à renseigner. Wikidata ne porte pas ce fait (consulté le 10 octobre 2026, ADR 0060) : aucune déclaration « dérivé du lexème » entre « gonie » (sans lexème) et « γονή » (L1104303). Non publiable tant que Wikidata ne le porte pas."
  }
}
