{
  "id": "rel_52bmhq8r",
  "unite_source_id": "unt_fdd5x50w",
  "unite_cible_id": "unt_7w5qh08v",
  "type_code": "forme_de_composition",
  "fait": {
    "confiance": "etablie",
    "etat_relecture": "brouillon",
    "sources": [
      {
        "source_id": "src_1g2et8hj",
        "localisation": null
      }
    ],
    "note_interne": "À vérifier : entrée « ἔξω » du Bailly, localisation à renseigner."
  }
}
