{
  "id": "rel_tbpfpzy6",
  "unite_source_id": "unt_f99vx9vj",
  "unite_cible_id": "unt_1p6hqgkh",
  "type_code": "forme_de_composition",
  "fait": {
    "confiance": "etablie",
    "etat_relecture": "brouillon",
    "sources": [
      {
        "source_id": "src_1g2et8hj",
        "localisation": null
      }
    ],
    "note_interne": "À vérifier : entrée « βραδύς » du Bailly, localisation à renseigner."
  }
}
