{
  "id": "rel_9ktyk7sc",
  "unite_source_id": "unt_3yayzmh1",
  "unite_cible_id": "unt_j9efe2gf",
  "type_code": "forme_de_composition",
  "fait": {
    "confiance": "etablie",
    "etat_relecture": "brouillon",
    "sources": [],
    "note_interne": "À vérifier : entrée « ἀντί » du Bailly, localisation à renseigner. Wikidata ne porte pas ce fait (consulté le 10 octobre 2026, ADR 0060) : aucune déclaration « dérivé du lexème » entre « anti » (L28892) et « ἀντί » (sans lexème). Non publiable tant que Wikidata ne le porte pas."
  }
}
