{
  "id": "rel_w9a7fgc3",
  "unite_source_id": "unt_018w5crm",
  "unite_cible_id": "unt_pyw5rdf3",
  "type_code": "emprunt",
  "fait": {
    "confiance": "etablie",
    "etat_relecture": "brouillon",
    "sources": [],
    "note_interne": "Chaîne relue dans la rubrique « Étymologie et histoire » de l’entrée « astronomie » du TLFi, le 9 octobre 2026. Wikidata ne porte pas ce fait (consulté le 10 octobre 2026, ADR 0060) : aucune déclaration « dérivé du lexème » entre « astronomie » (L16435) et « astronomia » (L259511). Non publiable tant que Wikidata ne le porte pas."
  }
}
