{
  "id": "rel_xfyvcwv6",
  "unite_source_id": "unt_474w41xr",
  "unite_cible_id": "unt_hvcgtsrp",
  "type_code": "emprunt",
  "fait": {
    "confiance": "etablie",
    "etat_relecture": "brouillon",
    "sources": [],
    "note_interne": "Chaîne relue dans la rubrique « Étymologie et histoire » de l’entrée « diamètre » du TLFi, le 9 octobre 2026. Wikidata ne porte pas ce fait (consulté le 10 octobre 2026, ADR 0060) : aucune déclaration « dérivé du lexème » entre « diamètre » (L20326) et « diametros » (L271803). Non publiable tant que Wikidata ne le porte pas."
  }
}
