{
  "id": "rel_1cmry18x",
  "unite_source_id": "unt_saxx1zy4",
  "unite_cible_id": "unt_ag4vyhpq",
  "type_code": "forme_de_composition",
  "fait": {
    "confiance": "etablie",
    "etat_relecture": "brouillon",
    "sources": [
      {
        "source_id": "src_1g2et8hj",
        "localisation": null
      }
    ],
    "note_interne": "À vérifier : entrée « κράτος » du Bailly, localisation à renseigner."
  }
}
