{
  "id": "rel_vvj5bb36",
  "unite_source_id": "unt_fy7ct6cd",
  "unite_cible_id": "unt_9804vdxg",
  "type_code": "emprunt",
  "fait": {
    "confiance": "etablie",
    "etat_relecture": "brouillon",
    "sources": [],
    "note_interne": "Chaîne relue dans la rubrique « Étymologie et histoire » de l’entrée « monochrome » du TLFi, le 9 octobre 2026. Wikidata ne porte pas ce fait (consulté le 10 octobre 2026, ADR 0060) : aucune déclaration « dérivé du lexème » entre « monochrome » (sans lexème) et « μονόχρωμος » (sans lexème). Non publiable tant que Wikidata ne le porte pas."
  }
}
