{
  "id": "rel_mar953ac",
  "unite_source_id": "unt_bg1nnwsk",
  "unite_cible_id": "unt_0kft1vzf",
  "type_code": "forme_de_composition",
  "fait": {
    "confiance": "etablie",
    "etat_relecture": "brouillon",
    "sources": [
      {
        "source_id": "src_1g2et8hj",
        "localisation": null
      }
    ],
    "note_interne": "À vérifier : entrée « ὀδούς » du Bailly, localisation à renseigner."
  }
}
